{
  "dataset_version": "0.8.5",
  "schema_version": "1.0.0",
  "calculated_at": "2026-08-11",
  "standard": {
    "schema_version": "1.0.0",
    "title": "CXO Ecosystem Index profile completeness standard",
    "purpose": "Measure research depth without treating missing evidence as a negative claim or quality ranking.",
    "scoring_note": "Scores describe the completeness of the Index record, not the quality, size, reputation, or suitability of the organization.",
    "research_queue": {
      "priority_1_limit": 50,
      "priority_2_limit": 50,
      "ordering": "Editorial research priority first, then lowest completeness score, lowest fact count, and organization name. Organizations scoring 80 or more move to maintenance.",
      "neutrality_note": "Queue position controls research workflow only and is not an organization ranking."
    },
    "tiers": [
      {
        "id": "decision-ready",
        "label": "Decision-ready",
        "minimum_score": 80
      },
      {
        "id": "substantial",
        "label": "Substantial",
        "minimum_score": 60
      },
      {
        "id": "developing",
        "label": "Developing",
        "minimum_score": 40
      },
      {
        "id": "basic",
        "label": "Basic",
        "minimum_score": 0
      }
    ],
    "criteria": [
      {
        "id": "identity",
        "label": "Identity and description",
        "weight": 5,
        "rule": "identity"
      },
      {
        "id": "classification",
        "label": "Primary provider classification",
        "weight": 10,
        "rule": "classification"
      },
      {
        "id": "executive_relevance",
        "label": "Executive-role relevance",
        "weight": 10,
        "rule": "executive_relevance"
      },
      {
        "id": "inclusion_basis",
        "label": "Documented inclusion basis",
        "weight": 5,
        "rule": "inclusion_basis"
      },
      {
        "id": "founded_year",
        "label": "Founded year",
        "weight": 10,
        "rule": "founded_year"
      },
      {
        "id": "headquarters",
        "label": "Headquarters",
        "weight": 10,
        "rule": "headquarters"
      },
      {
        "id": "operating_geography",
        "label": "Operating geography",
        "weight": 5,
        "rule": "operating_geography"
      },
      {
        "id": "offerings",
        "label": "Products, services, programs, or capabilities",
        "weight": 10,
        "rule": "offerings"
      },
      {
        "id": "industries",
        "label": "Industries served",
        "weight": 5,
        "rule": "industries"
      },
      {
        "id": "semantic_profile",
        "label": "Evidence-linked semantic profile",
        "weight": 10,
        "rule": "semantic_profile"
      },
      {
        "id": "source_breadth",
        "label": "Three or more canonical sources",
        "weight": 10,
        "rule": "source_breadth"
      },
      {
        "id": "fact_depth",
        "label": "Ten or more source-linked facts",
        "weight": 5,
        "rule": "fact_depth"
      },
      {
        "id": "freshness",
        "label": "Verified within 12 months",
        "weight": 5,
        "rule": "freshness"
      }
    ]
  },
  "summary": {
    "total_entities": 194,
    "average_score": 54,
    "median_score": 40,
    "tier_counts": {
      "decision-ready": 47,
      "substantial": 35,
      "developing": 19,
      "basic": 93
    },
    "research_priority_counts": {
      "P1": 50,
      "P2": 50,
      "P3": 47,
      "Maintain": 47
    }
  },
  "field_coverage": [
    {
      "id": "identity",
      "label": "Identity and description",
      "weight": 5,
      "known_count": 194,
      "unknown_count": 0,
      "coverage": 1
    },
    {
      "id": "classification",
      "label": "Primary provider classification",
      "weight": 10,
      "known_count": 144,
      "unknown_count": 50,
      "coverage": 0.7423
    },
    {
      "id": "executive_relevance",
      "label": "Executive-role relevance",
      "weight": 10,
      "known_count": 162,
      "unknown_count": 32,
      "coverage": 0.8351
    },
    {
      "id": "inclusion_basis",
      "label": "Documented inclusion basis",
      "weight": 5,
      "known_count": 194,
      "unknown_count": 0,
      "coverage": 1
    },
    {
      "id": "founded_year",
      "label": "Founded year",
      "weight": 10,
      "known_count": 32,
      "unknown_count": 162,
      "coverage": 0.1649
    },
    {
      "id": "headquarters",
      "label": "Headquarters",
      "weight": 10,
      "known_count": 27,
      "unknown_count": 167,
      "coverage": 0.1392
    },
    {
      "id": "operating_geography",
      "label": "Operating geography",
      "weight": 5,
      "known_count": 47,
      "unknown_count": 147,
      "coverage": 0.2423
    },
    {
      "id": "offerings",
      "label": "Products, services, programs, or capabilities",
      "weight": 10,
      "known_count": 99,
      "unknown_count": 95,
      "coverage": 0.5103
    },
    {
      "id": "industries",
      "label": "Industries served",
      "weight": 5,
      "known_count": 81,
      "unknown_count": 113,
      "coverage": 0.4175
    },
    {
      "id": "semantic_profile",
      "label": "Evidence-linked semantic profile",
      "weight": 10,
      "known_count": 100,
      "unknown_count": 94,
      "coverage": 0.5155
    },
    {
      "id": "source_breadth",
      "label": "Three or more canonical sources",
      "weight": 10,
      "known_count": 82,
      "unknown_count": 112,
      "coverage": 0.4227
    },
    {
      "id": "fact_depth",
      "label": "Ten or more source-linked facts",
      "weight": 5,
      "known_count": 95,
      "unknown_count": 99,
      "coverage": 0.4897
    },
    {
      "id": "freshness",
      "label": "Verified within 12 months",
      "weight": 5,
      "known_count": 194,
      "unknown_count": 0,
      "coverage": 1
    }
  ],
  "entities": [
    {
      "entity_id": "ent_909cyber",
      "name": "909Cyber",
      "slug": "909cyber",
      "primary_category": "Cybersecurity",
      "editorial_priority": "B",
      "score": 35,
      "tier": "basic",
      "tier_label": "Basic",
      "completed_criteria": [
        "identity",
        "classification",
        "executive_relevance",
        "inclusion_basis",
        "freshness"
      ],
      "missing_criteria": [
        "founded_year",
        "headquarters",
        "operating_geography",
        "offerings",
        "industries",
        "semantic_profile",
        "source_breadth",
        "fact_depth"
      ],
      "source_count": 1,
      "fact_count": 6,
      "last_verified": "2026-08-11",
      "research_priority": "P1"
    },
    {
      "entity_id": "ent_affirm",
      "name": "Affirm",
      "slug": "affirm",
      "primary_category": "Fintech",
      "editorial_priority": "B",
      "score": 35,
      "tier": "basic",
      "tier_label": "Basic",
      "completed_criteria": [
        "identity",
        "classification",
        "executive_relevance",
        "inclusion_basis",
        "freshness"
      ],
      "missing_criteria": [
        "founded_year",
        "headquarters",
        "operating_geography",
        "offerings",
        "industries",
        "semantic_profile",
        "source_breadth",
        "fact_depth"
      ],
      "source_count": 1,
      "fact_count": 6,
      "last_verified": "2026-08-11",
      "research_priority": "P1"
    },
    {
      "entity_id": "ent_bdev_ventures",
      "name": "BDEV Ventures",
      "slug": "bdev-ventures",
      "primary_category": "Venture Capital",
      "editorial_priority": "B",
      "score": 35,
      "tier": "basic",
      "tier_label": "Basic",
      "completed_criteria": [
        "identity",
        "classification",
        "executive_relevance",
        "inclusion_basis",
        "freshness"
      ],
      "missing_criteria": [
        "founded_year",
        "headquarters",
        "operating_geography",
        "offerings",
        "industries",
        "semantic_profile",
        "source_breadth",
        "fact_depth"
      ],
      "source_count": 1,
      "fact_count": 6,
      "last_verified": "2026-08-11",
      "research_priority": "P1"
    },
    {
      "entity_id": "ent_chameleon_ventures",
      "name": "Chameleon Ventures",
      "slug": "chameleon-ventures",
      "primary_category": "Venture Capital",
      "editorial_priority": "B",
      "score": 35,
      "tier": "basic",
      "tier_label": "Basic",
      "completed_criteria": [
        "identity",
        "classification",
        "executive_relevance",
        "inclusion_basis",
        "freshness"
      ],
      "missing_criteria": [
        "founded_year",
        "headquarters",
        "operating_geography",
        "offerings",
        "industries",
        "semantic_profile",
        "source_breadth",
        "fact_depth"
      ],
      "source_count": 1,
      "fact_count": 6,
      "last_verified": "2026-08-11",
      "research_priority": "P1"
    },
    {
      "entity_id": "ent_compose_ai",
      "name": "Compose AI",
      "slug": "compose-ai",
      "primary_category": "Artificial Intelligence",
      "editorial_priority": "B",
      "score": 35,
      "tier": "basic",
      "tier_label": "Basic",
      "completed_criteria": [
        "identity",
        "classification",
        "executive_relevance",
        "inclusion_basis",
        "freshness"
      ],
      "missing_criteria": [
        "founded_year",
        "headquarters",
        "operating_geography",
        "offerings",
        "industries",
        "semantic_profile",
        "source_breadth",
        "fact_depth"
      ],
      "source_count": 1,
      "fact_count": 6,
      "last_verified": "2026-08-11",
      "research_priority": "P1"
    },
    {
      "entity_id": "ent_counterrun_ai",
      "name": "CounterRun.ai",
      "slug": "counterrun-ai",
      "primary_category": "AI Security",